{
  "$schema": "./.thecrucible.schema.json",
  "schemaVersion": 1,
  "project": {
    "name": "The Crucible",
    "projectId": "the-crucible"
  },
  "commands": {
    "verify": [
      { "name": "Engine tests", "run": "npm", "args": ["test"] }
    ]
  },
  "artifacts": ["package.json"],
  "clutter": {
    "allow": [
      { "path": "templates/ai-conflicts.example.json", "reason": "The adopter template intentionally begins byte-for-byte identical to this repository's empty mandatory AI conflict ledger.", "owner": "jonathanblunt1214-lgtm", "expires": "2027-08-26" },
      { "path": "templates/thecrucible-local.example.json", "reason": "The local policy template intentionally starts byte-for-byte identical to the global policy template: both scopes share the exact same empty preferences/rules/settings schema (see src/globalPolicy.js), differing only in which tracked file the resulting policy is written to.", "owner": "jonathanblunt1214-lgtm", "expires": "2027-08-27" }
    ],
    "allowDuplicateContent": false,
    "blockTrackedIgnored": true
  },
  "privacy": {
    "githubIdentity": "6076446993",
    "scanContactInformation": true
  },
  "security": {
    "allow": [
      { "path": "src/security.js", "reason": "The scanner defines the signatures it detects.", "owner": "jonathanblunt1214-lgtm", "expires": "2027-08-24" },
      { "path": "src/code-check.js", "reason": "The language-aware parser uses Node's compile-only API to validate changed JavaScript without executing it.", "owner": "jonathanblunt1214-lgtm", "expires": "2027-08-24" },
      { "path": "test/security.test.js", "reason": "Adversarial fixtures intentionally contain recognizable payloads.", "owner": "jonathanblunt1214-lgtm", "expires": "2027-08-24" },
      { "path": "test/hardening.test.js", "reason": "Hardening tests exercise dynamic-execution and dependency-policy fixtures.", "owner": "jonathanblunt1214-lgtm", "expires": "2027-08-24" },
      { "path": "test/quarantine.test.js", "reason": "Quarantine fixtures intentionally contain recognizable payloads to test end-to-end quarantining of flagged content.", "owner": "jonathanblunt1214-lgtm", "expires": "2027-08-24" }
    ],
    "allowBinaries": [],
    "dependencyAudit": [],
    "provenanceAudit": [],
    "dependencyPolicy": { "enabled": true, "denyGit": true, "denyHttp": true, "denyLocal": true, "allowedRegistryHosts": ["registry.npmjs.org"], "denyLicenses": ["GPL-3.0-only", "AGPL-3.0-only"] }
  },
  "authenticity": {
    "requireArtifacts": true,
    "claims": [
      {
        "name": "Engine test suite passes",
        "run": "npm",
        "args": ["test"],
        "evidence": ["package.json"],
        "learning": {
          "claimBoundary": "the configured Engine test suite at the current commit on the current declared OS and Node runtime",
          "generalizationBoundary": "no wider than the exact commit, configured suite, OS, Node runtime, command digest, and evidence-artifact digests",
          "expectedOutcome": "the configured Engine test command completes successfully and every declared evidence artifact exists",
          "environment": "The Crucible governed authenticity runner using the checked-out commit and the job's declared OS and Node runtime"
        }
      }
    ]
  },
  "codeCheck": {
    "commands": [
      { "name": "Affected Node tests", "run": "npm", "args": ["test"], "include": ["src/**", "test/**", "package.json", ".thecrucible.json", ".thecrucible.schema.json", "AI-CONFLICTS.json", "AI-HANDOFF.json"], "failureAction": "test failure" }
    ]
  },
  "governance": { "requireExceptionMetadata": true, "failOnDisabledSecurity": true },
  "reproducibility": { "enabled": false, "commands": [], "artifacts": [] },
  "workload": {
    "workers": 2,
    "cycles": 2,
    "timeoutMinutes": 4,
    "timeoutMinutesByPlatform": { "win32": 6 },
    "maxOutputBytes": 1048576,
    "execution": { "network": "allow" }
  }
}
